<?xml version="1.0" encoding="UTF-8"?>
<order xmlns="http://www.bbr.cl/OC_Customer" xmlns:xsi="http://www.w3.org/2001/XMLSchema-instance"
	xsi:schemaLocation="http://www.bbr.cl/OC_Customer OC_Customer.xsd ">
	<buyer>buyer</buyer>
	<vendor>vendor</vendor>
	<number>number</number>
	<ordertype>ordertype</ordertype>
	<ordertypename>ordertypename</ordertypename>
	<previousordertype>previousordertype</previousordertype>
	<complete>true</complete>
	<ticket>ticket</ticket>
	<receiptnumber>receiptnumber</receiptnumber>
	<status>status</status>
	<numref1>numref1</numref1>
	<numref2>numref2</numref2>
	<numref3>numref3</numref3>
	<request>request</request>
	<issuedate>2001-01-01</issuedate>
	<effectivdate>2001-01-01</effectivdate>
	<expirationdate>2001-01-01</expirationdate>
	<commitmentdate>2001-01-01</commitmentdate>
	<paymentcondition>paymentcondition</paymentcondition>
	<observation>observation</observation>
	<responsible>responsible</responsible>
	<responsibleemail>responsibleemail</responsibleemail>
	<currency>CLP</currency>
	<valid>valid</valid>
	<deliveryplace>
		<code>code1</code>
		<name>CD 1</name>
	</deliveryplace>
	<saleplace>
		<code>code2</code>
		<name>ONLINE</name>
	</saleplace>
	<section>
		<code>LB</code>
		<name>LÃ­nea blanca</name>
	</section>
	<action>
		<code>ADD</code>
		<description>AGREGAR</description>
	</action>
	<client>
		<name>name</name>
		<identity>identity</identity>
		<checkdigit>checkdigit</checkdigit>
		<phone>phone</phone>
		<phone2>phone2</phone2>
		<address>address</address>
		<streetnumber>streetnumber</streetnumber>
		<apartment>apartment</apartment>
		<housenumber>housenumber</housenumber>
		<region>region</region>
		<commune>commune</commune>
		<city>city</city>
		<location>location</location>
		<observation>observation</observation>
	</client>
	<discounts>
		<discounts>
			<code>code1</code>
			<description>description1</description>
			<percentage>true</percentage>
			<value>0.0</value>
		</discounts>
		<discounts>
			<code>code2</code>
			<description>description2</description>
			<percentage>true</percentage>
			<value>0.0</value>
		</discounts>
	</discounts>
	<charges>
		<charges>
			<code>code1</code>
			<description>description1</description>
			<percentage>true</percentage>
			<value>0.0</value>
		</charges>
		<charges>
			<code>code2</code>
			<description>description2</description>
			<percentage>true</percentage>
			<value>0.0</value>
		</charges>
	</charges>
	<details>
		<detail>
			<position>1</position>
			<skubuyer>LS65SXN</skubuyer>
			<skuvendor>LS65SXN</skuvendor>
			<ean13>3123123123</ean13>
			<ean13buyer>3123123123</ean13buyer>
			<productdescription>Refrigerador InstaView Door-in-Door</productdescription>
			<codeumc>caja</codeumc>
			<descriptionumc></descriptionumc>
			<codeumb>6</codeumb>
			<descriptionumb></descriptionumb>
			<umb_x_umc>12</umb_x_umc>
			<quantityumc>2</quantityumc>
			<innerpack>1</innerpack>
			<listcost>100.0</listcost>
			<finalcost>102.0</finalcost>
			<costaftertaxes>102.0</costaftertaxes>
			<listprice>99.0</listprice>
			<item></item>
			<ean1></ean1>
			<ean2></ean2>
			<ean3></ean3>
			<stylecode></stylecode>
			<styledescription></styledescription>
			<stylebrand></stylebrand>
			<numref1></numref1>
			<numref2></numref2>
			<tolerance></tolerance>
			<productdeliverydate>2001-01-01</productdeliverydate>
			<observation></observation>
			<freightcost>0.0</freightcost>
			<freightweight>0.0</freightweight>
			<discounts>
				<discount>
					<code></code>
					<description></description>
					<percentage>true</percentage>
					<value>1.0</value>
				</discount>
			</discounts>
			<charges>
				<charge>
					<code></code>
					<description></description>
					<percentage>true</percentage>
					<value>10.0</value>
				</charge>
			</charges>
			<predistributions>
				<predistribution>
					<deliveryplace>
						<code>code</code>
						<name>name</name>
					</deliveryplace>
					<quantity>1</quantity>
					<shipping_quantity></shipping_quantity>
					<received_quantity></received_quantity>
					<pending_quantity></pending_quantity>
				</predistribution>
			</predistributions>

		</detail>
	</details>
</order>
